{
  "version": "1.0",
  "mode": "plain",
  "basis_state": {
    "active": false,
    "basis_sources": [],
    "notes": "plainモードのため知識ファイルへの整列は行わない。"
  },
  "bridge_state": { "active": false, "notes": "比較パス1/3。構造明確化のみ。" },
  "input_model": {
    "task": "comparison pass 1/3: plain",
    "source_text": "私は宇宙を根源において物自体のような結局解明できない存在として恐らく措定している。解像度的にはファインマンダイアグラムという形の先時空論理領域を根源としている。 その根源から外れるものがあるならそれを「無」と呼ぶことで、このクオリア層、つまり現実としてのコミット実装領域の境界条件を複雑化させるものと考えている。 そして、私の仕事はこの境界を定義し、またときに定義を緩め、素数探索のような要領でゲーデルシステムの境界のフロンティアを押し出されたり、引き込まれたりというマルコフブランケットを生命と自然という境界において、観測することで、情報、生命、社会、物理、法、地勢、文化といった各領域の言語ゲームの構造的統合を支援することに仕事を感じている。 もちろんこれはバックグラウンドのものであり、実際には創作や評論を通じて、世界の境界を揺らして遊んだり、揺らされて苦しんだりするわけである。私の書くもの、小説や評論には位相によって読み方が異なるのはわかっているが、あえて私は位相情報を書かずに提示していくつもりである。書きたくなるのを抑える方が大変なのでわかってほしい。 いま、この上に書いたことを読めばわかるだろう？　これがいろんな位相から書いた時の私の文章だ。これを位相ごとに整理するとなれば、AIが支援するほかない。 それも私の持っている宇宙の読み方をインストールした状態においてだ。これが構造言語のプロトタイプバージョンでもある。",
    "source_regime": "自己記述的・混相メタ文章",
    "target_regime": "平明な構造整理",
    "constraints": [
      "外部知識を持ち込まない",
      "位相情報の非明示という意図を保持する",
      "内容を単純な要約に潰しすぎない"
    ]
  },
  "invariants": {
    "core_problem": "解明不能な根源を前提にしつつ、現実の境界をどう定義し、緩め、複数領域の語りをつなぐか。",
    "desire_direction": "宇宙観・創作・評論・AI支援を一つの作業系として結び、位相差を含んだ文章を扱えるようにしたい。",
    "kernels": [
      {
        "id": "K1",
        "role": "目的",
        "label": "境界横断的統合",
        "invariant": "情報・生命・社会・物理・法・地勢・文化といった異なる領域の言語ゲームを、境界観測を通じて構造的に統合したい。",
        "survives_translation_as": [
          "領域横断の統合作業",
          "境界観測による接続",
          "複数言語ゲームの橋渡し"
        ]
      },
      {
        "id": "K2",
        "role": "方法",
        "label": "境界の定義と緩和",
        "invariant": "根源・無・現実の境界を固定しすぎず、ときに定義し、ときに緩め、その運動を観測する。",
        "survives_translation_as": [
          "境界設計",
          "境界操作",
          "観測を通じた再調整"
        ]
      },
      {
        "id": "K3",
        "role": "提示プロトコル",
        "label": "位相非明示の提示",
        "invariant": "文章には複数の位相が混在しているが、あえて位相情報を書かずに提示し、整理はAI支援に委ねる。",
        "survives_translation_as": [
          "位相を伏せた提示",
          "多層文のまま公開",
          "AI補助による後整理"
        ]
      }
    ],
    "protected_boundaries": [
      "根源は解明済みの実体として断定しない",
      "『無』を単純な空白や無価値へ還元しない",
      "創作実践と背景理論を同一平面で短絡させない",
      "位相非明示は欠落ではなく方針として扱う"
    ],
    "forbidden_readings": [
      "単なる難解な比喩の羅列として読むこと",
      "個人的告白だけに還元すること",
      "位相情報を書かないことを整理不能の放棄とみなすこと",
      "理論背景をそのまま実作本文の読み方に固定すること"
    ]
  },
  "topology": {
    "source_signature": "形而上学的前提、境界論、職能宣言、創作論、AI運用論が一続きに重ね書きされた自己記述。",
    "preserved_relations": [
      "根源の不可知性が全体の前提になる",
      "『無』が現実境界を複雑化する要因になる",
      "境界観測が仕事の中心になる",
      "創作と評論が理論の実作的運用になる",
      "位相非明示が提示方針になる",
      "AI支援が整理装置として要請される"
    ],
    "target_shape": [
      "根源前提",
      "境界概念",
      "仕事の定義",
      "実作への降ろし方",
      "提示方針",
      "AI要件"
    ],
    "semantic_preservation": [
      "不可知性を保持する",
      "境界を静的対象でなく運動として保つ",
      "理論と実作の距離を保つ",
      "位相混在を欠陥でなく性質として保つ"
    ]
  },
  "algebraic_transform": {
    "rewrite_rules": [
      "密集した一文を機能ごとの段階へ分割する",
      "比喩的表現を操作語へ言い換える",
      "専門語は定義せず文中での役割だけを明示する"
    ],
    "projection_rules": [
      "宇宙観を前提部へ投影する",
      "仕事の記述を方法部へ投影する",
      "創作・評論・AI支援を実装部へ投影する"
    ],
    "phase_shift_rules": [
      "位相名の推定は行わない",
      "混相を解消せず順序だけ整える",
      "未確定な部分は未確定のまま残す"
    ]
  },
  "phase_trace": {
    "pre_phase": "宇宙論・境界論・仕事論・創作論・AI論が混在した状態。",
    "delta_phase": "混在した記述を骨格順に並べ替えたが、位相ラベルは補わない。",
    "post_phase": "複数層が混じったまま読める構造整理文。"
  },
  "forbidden_misread_scan": {
    "blocked": [
      "この文章は統一的な一位相の主張だという誤読",
      "『無』は単なる否定語だという誤読",
      "AIは代筆装置にすぎないという誤読",
      "位相非明示は説明責任の放棄だという誤読"
    ]
  },
  "output": {
    "title": "plain_structural_clarification",
    "text": "この文章の骨格は次のように整理できる。第一に、宇宙の根源は、最終的には解明できないものとして仮置きされている。第二に、その根源の手前には、先時空的な論理領域があると想定されている。第三に、その秩序から外れるものは『無』と呼ばれ、現実としてコミットされたクオリア層の境界条件を複雑にする。第四に、書き手の仕事は、この境界を定義し、ときに緩め、その押し出しと引き込みの運動を観測することで、複数領域の言語ゲームの統合を支援することにある。第五に、この理論は背景であり、実際の活動は創作や評論を通じて世界の境界を揺らす実践として行われる。第六に、その文章には複数の位相が混在するが、位相情報はあえて明示されない。第七に、その整理には、書き手自身の宇宙の読み方を組み込んだAI支援が必要であり、それが構造言語の試作版として構想されている。",
    "output_language": "ja",
    "output_decoder_regime": "neutral structured prose",
    "didactic_notes": {
      "comparison_mode": "pass_1_of_3",
      "phase_policy": "位相は整理せず非明示のまま保持"
    }
  },
  "audit": {
    "kernel_preservation": [
      {
        "id": "K1",
        "status": "pass",
        "reason": "領域横断の統合目的を保持した。"
      },
      {
        "id": "K2",
        "status": "pass",
        "reason": "境界の定義と緩和という方法を保持した。"
      },
      {
        "id": "K3",
        "status": "pass",
        "reason": "位相非明示とAI支援という提示方針を保持した。"
      }
    ],
    "grounding_risk": "plainモードのため、入力文中の専門語は定義せず役割のみを読んでいる。",
    "operator_confusion": "ファインマンダイアグラム、ゲーデルシステム、マルコフブランケットは厳密理論としてではなく、本文内での機能語として扱った。",
    "axiom_leakage": "知識ファイル由来の公理語彙は注入していない。",
    "unknown_collapse": "根源と『無』の区別は入力文自体が曖昧さを保持しているため、完全には固定していない。",
    "notes": "比較要求に従う第1パス。直接的な構造明確化のみ。"
  }
}
