{
  "version": "1.0",
  "mode": "basis_on",
  "basis_state": {
    "active": true,
    "basis_sources": [
      "AMP_Core.md",
      "Information-Time Soliton Core Specification.md",
      "Godel_Frontier.md",
      "履歴場通信論序説.md",
      "世界観メモ v0.md",
      "README.md"
    ],
    "notes": "入力文を既存の基底語彙へ整列する。核抽出の強調や位相分解は行わない。"
  },
  "bridge_state": { "active": false, "notes": "比較パス2/3。基底整列のみ。" },
  "input_model": {
    "task": "comparison pass 2/3: basis_on",
    "source_text": "私は宇宙を根源において物自体のような結局解明できない存在として恐らく措定している。解像度的にはファインマンダイアグラムという形の先時空論理領域を根源としている。 その根源から外れるものがあるならそれを「無」と呼ぶことで、このクオリア層、つまり現実としてのコミット実装領域の境界条件を複雑化させるものと考えている。 そして、私の仕事はこの境界を定義し、またときに定義を緩め、素数探索のような要領でゲーデルシステムの境界のフロンティアを押し出されたり、引き込まれたりというマルコフブランケットを生命と自然という境界において、観測することで、情報、生命、社会、物理、法、地勢、文化といった各領域の言語ゲームの構造的統合を支援することに仕事を感じている。 もちろんこれはバックグラウンドのものであり、実際には創作や評論を通じて、世界の境界を揺らして遊んだり、揺らされて苦しんだりするわけである。私の書くもの、小説や評論には位相によって読み方が異なるのはわかっているが、あえて私は位相情報を書かずに提示していくつもりである。書きたくなるのを抑える方が大変なのでわかってほしい。 いま、この上に書いたことを読めばわかるだろう？　これがいろんな位相から書いた時の私の文章だ。これを位相ごとに整理するとなれば、AIが支援するほかない。 それも私の持っている宇宙の読み方をインストールした状態においてだ。これが構造言語のプロトタイプバージョンでもある。",
    "source_regime": "自己記述的・混相メタ文章",
    "target_regime": "basis-aligned structured prose",
    "constraints": [
      "基底ファイルの語彙へ整列する",
      "入力文の曖昧さを保持する",
      "位相を明示分解しない",
      "理論語彙を実証断言に変えない"
    ]
  },
  "invariants": {
    "core_problem": "未分化の根源、そこから外れた未定義領域、そしてコミットされた現実界面のあいだにある境界膜を、どう設計・観測・再調整するか。",
    "desire_direction": "構造言語を用いて、複数領域の通信境界を連結し、文明的・創作的・認識論的な探索を同一の語彙で運用したい。",
    "kernels": [
      {
        "id": "K1",
        "role": "目的",
        "label": "構造言語による領域横断",
        "invariant": "情報・生命・社会・物理・法・地勢・文化の各領域を、別々の学問分野ではなく、相互運用可能な言語ゲームとして統合したい。",
        "survives_translation_as": [
          "通信系の統合",
          "構造言語での横断",
          "文明探索の接続"
        ]
      },
      {
        "id": "K2",
        "role": "方法",
        "label": "境界膜の観測と調整",
        "invariant": "マルコフブランケット的な境界膜を定義し、ときに緩め、その押し引きを観測することによって、何が現実界面にコミットされるかを扱う。",
        "survives_translation_as": [
          "境界膜設計",
          "インピーダンス調整",
          "観測による再編"
        ]
      },
      {
        "id": "K3",
        "role": "提示プロトコル",
        "label": "位相非明示の実装",
        "invariant": "複数位相の文章をあえて位相ラベルなしで提示し、後段でAIが整理支援できるようにする。",
        "survives_translation_as": [
          "位相潜在化",
          "後段整列",
          "構造言語プロトタイプ"
        ]
      }
    ],
    "protected_boundaries": [
      "根源はAMP的な未分化の場に近いが、完全同定しない",
      "『無』はSector_0や未定義領域と響き合うが、一対一対応に固定しない",
      "現実はクオリア層・コミット実装領域として扱い、単純な物理実在論へ落とさない",
      "ゲーデル境界と素数探索は文明的探索の比喩を含むため、純粋数学へ閉じない",
      "位相非明示は実装方針であり、単なる省略ではない"
    ],
    "forbidden_readings": [
      "AMP/ITSの用語辞書に完全従属した自己説明だと読むこと",
      "『無』を単なる虚無主義や欠陥として読むこと",
      "マルコフブランケットを神経科学用語の直輸入だけで読むこと",
      "創作と評論を背景理論の説明書として読むこと"
    ]
  },
  "topology": {
    "source_signature": "不可知の根源、未定義領域、クオリア界面、境界膜、文明探索、創作実装、位相潜在化、AI整理という層が連続接続された文章。",
    "preserved_relations": [
      "根源は未分化の可能性場に近い位置を占める",
      "『無』は境界条件を複雑化する未定義外部として働く",
      "クオリア層はコミットされた現実界面として置かれる",
      "仕事は境界膜の設計と観測として定義される",
      "素数探索とゲーデル境界が探索アルゴリズム的方向を与える",
      "創作・評論が構造言語の実作実装になる",
      "AIは位相整理の補助回路として要請される"
    ],
    "target_shape": [
      "根源場",
      "外部未定義領域",
      "現実界面",
      "境界膜の仕事",
      "文明探索としての知的実践",
      "創作実装",
      "AI支援"
    ],
    "semantic_preservation": [
      "不可知性を基底公理へ整列しつつ固定しない",
      "境界操作を通信論的語彙へ整列する",
      "文明探索の比喩性を保持する",
      "位相潜在化の方針を保持する"
    ]
  },
  "algebraic_transform": {
    "rewrite_rules": [
      "『根源』を未分化の可能性場に寄せて読む",
      "『無』を未定義領域または境界撹乱因として読む",
      "『クオリア層』を現実界面・コミット実装領域として読む",
      "『境界』を境界膜・インピーダンス・観測可能帯域の問題として読む"
    ],
    "projection_rules": [
      "宇宙観をTruth Layer相当へ投影する",
      "クオリアと境界操作をBeauty Layer相当へ投影する",
      "ゲーデル境界と素数探索をGoodness Layer相当へ投影する",
      "創作と評論を理論の本文実装へ投影する"
    ],
    "phase_shift_rules": [
      "位相の個別ラベル化はしない",
      "基底語彙への整列のみを行う",
      "創作層・理論層・運用層の対応は緩く保つ"
    ]
  },
  "phase_trace": {
    "pre_phase": "形而上学、通信論、文明論、創作論、AI運用論が混相で記述されている。",
    "delta_phase": "語彙を基底理論の座標へ整列したが、層の分離は行っていない。",
    "post_phase": "基底整合されたまま多層性を保つ説明文。"
  },
  "forbidden_misread_scan": {
    "blocked": [
      "この文章はAMP/ITS各文書の逐語的要約であるという誤読",
      "『無』とSector_0を完全同一視する誤読",
      "位相非明示を理論不足の証拠とする誤読",
      "AI支援を理論の代行思考とみなす誤読"
    ]
  },
  "output": {
    "title": "basis_aligned_restatement",
    "text": "基底語彙に沿って言い換えると、この文章は次のようになる。宇宙はまず、最終的には解明し尽くせない根源場を背後にもつ。そのうえで、現実はクオリアとしてコミットされた界面であり、その界面の外側ないし逸脱部にあたる未定義領域が『無』として働き、境界条件を複雑化させる。書き手の仕事は、この現実界面と外部のあいだにある境界膜を定義し、必要に応じて緩め、その押し出しと引き込みを観測することにある。そこで観測されるのは、生命と自然のあいだに生じるマルコフブランケット的な境界運動であり、その観測を通じて情報、生命、社会、物理、法、地勢、文化といった領域の言語ゲームを同一の構造言語へ接続しようとしている。素数探索やゲーデル境界という語は、既知の公理系を越えて新しい論理深度を探る探索様式を示している。もっとも、この理論は背景層に置かれており、実際の前景では創作や評論が、世界の境界を揺らす実装として機能する。さらに、文章には複数の位相が重なっているが、その位相情報はあえて伏せられる。したがってAIに求められるのは、位相を勝手に固定することではなく、書き手の宇宙の読み方を前提にして、潜在化された位相を後から整理できる構造言語の補助装置になることである。",
    "output_language": "ja",
    "output_decoder_regime": "basis-aligned structured prose",
    "didactic_notes": {
      "comparison_mode": "pass_2_of_3",
      "basis_alignment": [
        "未分化の根源場",
        "現実界面",
        "境界膜",
        "ゲーデル・フロンティア",
        "構造言語"
      ],
      "phase_policy": "位相を明示分解しない"
    }
  },
  "audit": {
    "kernel_preservation": [
      {
        "id": "K1",
        "status": "pass",
        "reason": "領域横断の統合目的を基底語彙へ整列した。"
      },
      {
        "id": "K2",
        "status": "pass",
        "reason": "境界膜の観測と調整として方法を保持した。"
      },
      {
        "id": "K3",
        "status": "pass",
        "reason": "位相潜在化とAI整理支援の方針を保持した。"
      }
    ],
    "grounding_risk": "基底文書群との共鳴を用いたため、入力文固有のニュアンスがやや整いすぎるリスクがある。",
    "operator_confusion": "AMP的根源場、ITS的現実界面、履歴場通信論的境界語彙を並列使用しているため、厳密同一視は避けた。",
    "axiom_leakage": "基底語彙への整列はあるが、入力文にない断定的数理や体系順序は注入していない。",
    "unknown_collapse": "『ファインマンダイアグラムという形の先時空論理領域』は基底文書群に厳密対応項がないため、前時空的論理領域として緩く保持した。",
    "notes": "比較要求に従う第2パス。基底整列は行うが橋渡し的核抽出までは進めない。"
  }
}
