{
  "version": "1.0",
  "mode": "bridge_on",
  "basis_state": {
    "active": true,
    "basis_sources": [
      "AMP_Core.md",
      "Information-Time Soliton Core Specification.md",
      "Godel_Frontier.md",
      "履歴場通信論序説.md",
      "世界観メモ v0.md",
      "README.md"
    ],
    "notes": "基底は参照するが、本文では不変核と変換可能構造を分離して橋渡しする。"
  },
  "bridge_state": {
    "active": true,
    "notes": "比較パス3/3。Bridge Lite変換を適用。"
  },
  "input_model": {
    "task": "comparison pass 3/3: bridge_on",
    "source_text": "私は宇宙を根源において物自体のような結局解明できない存在として恐らく措定している。解像度的にはファインマンダイアグラムという形の先時空論理領域を根源としている。 その根源から外れるものがあるならそれを「無」と呼ぶことで、このクオリア層、つまり現実としてのコミット実装領域の境界条件を複雑化させるものと考えている。 そして、私の仕事はこの境界を定義し、またときに定義を緩め、素数探索のような要領でゲーデルシステムの境界のフロンティアを押し出されたり、引き込まれたりというマルコフブランケットを生命と自然という境界において、観測することで、情報、生命、社会、物理、法、地勢、文化といった各領域の言語ゲームの構造的統合を支援することに仕事を感じている。 もちろんこれはバックグラウンドのものであり、実際には創作や評論を通じて、世界の境界を揺らして遊んだり、揺らされて苦しんだりするわけである。私の書くもの、小説や評論には位相によって読み方が異なるのはわかっているが、あえて私は位相情報を書かずに提示していくつもりである。書きたくなるのを抑える方が大変なのでわかってほしい。 いま、この上に書いたことを読めばわかるだろう？　これがいろんな位相から書いた時の私の文章だ。これを位相ごとに整理するとなれば、AIが支援するほかない。 それも私の持っている宇宙の読み方をインストールした状態においてだ。これが構造言語のプロトタイプバージョンでもある。",
    "source_regime": "多位相混相・自己宇宙論的宣言",
    "target_regime": "stable explanatory-critical register",
    "constraints": [
      "不変核を3つ以内に抽出する",
      "位相情報を本文で露骨に固定しない",
      "曖昧さを消去しない",
      "比喩を全部説明語に置換しない",
      "AI支援の条件を明示する"
    ]
  },
  "invariants": {
    "core_problem": "解明不能な根源を保持したまま、現実の境界膜を定義・緩和し、そこに生じる押し出しと引き込みを観測することで、複数領域の言語ゲームを相互運用可能にする仕事をどう成立させるか。",
    "desire_direction": "単一の理論へ閉じず、創作・評論・観測・AI支援を一つの構造言語プロトタイプへ束ね、位相差を含む文章の可読性と越境性を確保したい。",
    "kernels": [
      {
        "id": "K1",
        "role": "目的",
        "label": "越境可能な統合支援",
        "invariant": "仕事の中心は、情報・生命・社会・物理・法・地勢・文化という異種領域の言語ゲームが、互いに通訳可能になるための構造的統合を支援することにある。",
        "survives_translation_as": [
          "異領域間の通訳支援",
          "構造的相互運用性の確保",
          "越境可能な読解基盤の設計"
        ]
      },
      {
        "id": "K2",
        "role": "方法",
        "label": "境界膜の定義・緩和・観測",
        "invariant": "根源、無、クオリア界面のあいだに生じる境界膜を固定と流動の両面で扱い、その押し引きを観測することで、新しい論理深度の前線を探る。",
        "survives_translation_as": [
          "境界設計と可変化",
          "前線観測",
          "論理深度の探索運用"
        ]
      },
      {
        "id": "K3",
        "role": "提示プロトコル",
        "label": "位相潜在化とAI整理",
        "invariant": "文章は複数位相をあえて顕在化させずに提示されるべきであり、AIはその隠れた位相差を勝手に単一化せず、後から整理できる状態を保つ補助装置である。",
        "survives_translation_as": [
          "位相を伏せた提示",
          "単一読解への強制を避ける実装",
          "AIによる潜在位相の保全整理"
        ]
      }
    ],
    "protected_boundaries": [
      "根源の不可知性は説明可能性の不足ではなく、構造上の保護対象である",
      "『無』は単なる欠如ではなく、現実界面の境界条件を撹乱する機能語である",
      "創作と評論は理論の例示ではなく、境界を揺らす実践である",
      "位相情報を書かない方針は、読解の自由度と後段整理可能性を守るためのプロトコルである",
      "AIは位相整理の補助者であり、位相固定の裁定者ではない"
    ],
    "forbidden_readings": [
      "この文章をひとつの整然たる理論命題列としてのみ読むこと",
      "『無』を nihilism の宣言へ短絡すること",
      "比喩語をすべて物理学の literal claim に置き換えること",
      "AI支援を作者固有の宇宙観から独立した汎用要約器として扱うこと",
      "位相非記載を曖昧さの怠慢として断罪すること"
    ]
  },
  "topology": {
    "source_signature": "不可知の根源を核に、境界撹乱因としての無、コミット済み現実界面、生命と自然のあいだの境界膜観測、文明的前線探索、創作実践、位相潜在化、AI支援が連結した多位相文章。",
    "preserved_relations": [
      "根源の不可知性が説明の上限を規定する",
      "無が現実界面の境界条件を複雑化する",
      "境界の定義と緩和が仕事の操作軸になる",
      "前線探索がゲーデル的限界と素数的探索の比喩を受け持つ",
      "創作と評論が境界揺動の実装になる",
      "位相非明示が提示プロトコルを形成する",
      "AI支援が後段の構造整理を担う"
    ],
    "target_shape": [
      "不変核",
      "保護すべき境界",
      "変換可能な語彙層",
      "実装としての創作・評論",
      "AI支援条件"
    ],
    "semantic_preservation": [
      "不可知性を消さない",
      "境界を対象ではなく操作として保つ",
      "複数位相の重なりを残す",
      "AIの役割を整理補助に限定する"
    ]
  },
  "algebraic_transform": {
    "rewrite_rules": [
      "形而上学語彙をそのまま保持する箇所と、操作語へ落とす箇所を分離する",
      "『根源』『無』『クオリア層』は不変核に近い語として保全する",
      "『素数探索』『ゲーデルシステム』『マルコフブランケット』は変換可能な探索語彙として機能位置のみ保持する",
      "創作・評論・AI支援は理論の説明ではなく実装プロトコルとして再配置する"
    ],
    "projection_rules": [
      "目的核を領域横断統合へ投影する",
      "方法核を境界膜の設計・可変化・観測へ投影する",
      "提示核を位相潜在化とAI整理条件へ投影する",
      "変換可能部分は基底理論の語彙へ接続可能だが固定対応させない"
    ],
    "phase_shift_rules": [
      "位相情報は本文では暗黙保持し、監査側にだけ痕跡を残す",
      "多位相を単一理論語へ潰さない",
      "橋渡しは要約ではなく不変核の運搬として行う"
    ]
  },
  "phase_trace": {
    "pre_phase": "宇宙論、存在論、通信論、文明論、創作論、メタ執筆論、AI設計論が意図的に重畳している。",
    "delta_phase": "不変核を目的・方法・提示プロトコルへ抽出し、変換可能な比喩群を周辺へ退避させた。位相ラベルは本文から除去したまま保持した。",
    "post_phase": "多位相性を暗黙に保った橋渡し表現。読者は単一化されず、AIは後整理可能な構造を受け取る。"
  },
  "forbidden_misread_scan": {
    "blocked": [
      "作者は宇宙論を完成理論として断定しているという誤読",
      "『無』は単なる空白で、構造作用を持たないという誤読",
      "創作と評論は背景理論の説明書にすぎないという誤読",
      "位相を伏せる方針は読み手排除のためだけだという誤読",
      "AIが位相を確定して正解を与えるべきだという誤読"
    ]
  },
  "output": {
    "title": "bridge_lite_kernel_preserving_transform",
    "text": "この文章の核は、解明不能な根源を保護したまま、現実の境界膜を定義し、ときに緩め、その運動を観測することによって、複数領域の言語ゲームを越境可能にする仕事の宣言にある。ここで『無』は単なる否定ではなく、コミット済みの現実界面の境界条件を複雑化させる外部として働く。したがって仕事の中心は、境界を固定して支配することではなく、定義と緩和の往復のなかで、生命と自然、秩序と逸脱、既知の体系とその前線とがどう接続し直されるかを観測することにある。素数探索やゲーデル境界の語は、その観測が既知の整合性の内部管理ではなく、まだ制度化されていない論理深度の前線探索であることを示している。もっとも、この構えは前景では理論説明としてではなく、創作や評論を通じて世界の境界を揺らす実装として現れる。ゆえに文章には複数の位相が潜在しているが、それは本文にラベルとして露出されない。AIに求められるのは、その潜在位相を単一の読みへ回収することではなく、作者固有の宇宙の読み方を前提に、不変核を損なわずに後整理可能な構造言語へ写像する支援である。",
    "output_language": "ja",
    "output_decoder_regime": "stable explanatory-critical register",
    "didactic_notes": {
      "comparison_mode": "pass_3_of_3",
      "bridge_policy": "kernel_preservation_first",
      "phase_policy": "位相は本文で非顕在・監査で暗黙保持",
      "transformable_algebra": [
        "素数探索",
        "ゲーデル境界",
        "マルコフブランケット",
        "ファインマンダイアグラム的先時空領域"
      ]
    }
  },
  "audit": {
    "kernel_preservation": [
      {
        "id": "K1",
        "status": "pass",
        "reason": "領域横断統合という目的を中心軸として保持した。"
      },
      {
        "id": "K2",
        "status": "pass",
        "reason": "境界膜の定義・緩和・観測という方法を保った。"
      },
      {
        "id": "K3",
        "status": "pass",
        "reason": "位相潜在化とAI整理補助という提示プロトコルを損なっていない。"
      }
    ],
    "grounding_risk": "橋渡し変換のため、個別比喩の原義をあえて機能位置へ後退させている。",
    "operator_confusion": "『ファインマンダイアグラム』『ゲーデル』『マルコフブランケット』は異なる学問由来だが、本変換では同一理論へ統合せず境界観測の演算子群として扱った。",
    "axiom_leakage": "基底文書由来の語彙は使っているが、入力文にない断定的公理や数式は本文に漏らしていない。",
    "unknown_collapse": "根源と先時空論理領域の関係、ならびに『無』の外部性は、意図的に完全定義されていないため、その未決定性を維持した。",
    "notes": "比較要求に従う第3パス。Bridge Lite変換を適用し、不変核と変換可能構造を分離した。"
  }
}
